[
  {
    "id": "AlderWand",
    "_source": "AlderWand.cs",
    "damage": 17,
    "useTime": 24,
    "mana": 6,
    "knockBack": 4.0,
    "rarity": "Blue",
    "obsolete": false,
    "hasRecipe": true,
    "isAccessory": false
  },
  {
    "id": "AlohomoraWand",
    "_source": "AlohomoraWand.cs",
    "damage": 1,
    "useTime": 30,
    "mana": 8,
    "knockBack": 0.0,
    "rarity": "Blue",
    "obsolete": false,
    "hasRecipe": true,
    "isAccessory": false
  },
  {
    "id": "AshWand",
    "_source": "AshWand.cs",
    "damage": 22,
    "useTime": 20,
    "mana": 8,
    "knockBack": 4.0,
    "rarity": "Blue",
    "obsolete": false,
    "hasRecipe": true,
    "isAccessory": false
  },
  {
    "id": "BirchWand",
    "_source": "BirchWand.cs",
    "damage": 28,
    "useTime": 20,
    "mana": 10,
    "knockBack": 10.0,
    "rarity": "Lt Red",
    "obsolete": false,
    "hasRecipe": true,
    "isAccessory": false
  },
  {
    "id": "BlackthornWand",
    "_source": "BlackthornWand.cs",
    "damage": 35,
    "useTime": 28,
    "mana": 14,
    "knockBack": 3.0,
    "rarity": "Lt Red",
    "obsolete": false,
    "hasRecipe": true,
    "isAccessory": false
  },
  {
    "id": "CedarWand",
    "_source": "CedarWand.cs",
    "damage": 15,
    "useTime": 35,
    "mana": 15,
    "knockBack": 2.0,
    "rarity": "Orange",
    "obsolete": false,
    "hasRecipe": true,
    "isAccessory": false
  },
  {
    "id": "CypressWand",
    "_source": "CypressWand.cs",
    "damage": 30,
    "useTime": 35,
    "mana": 15,
    "knockBack": 2.0,
    "rarity": "Lt Red",
    "obsolete": false,
    "hasRecipe": true,
    "isAccessory": false
  },
  {
    "id": "DragonHeartstringWand",
    "_source": "DragonHeartstringWand.cs",
    "damage": 42,
    "useTime": 15,
    "mana": 12,
    "knockBack": 5.0,
    "rarity": "Lt Red",
    "obsolete": false,
    "hasRecipe": true,
    "isAccessory": false
  },
  {
    "id": "EbonyWand",
    "_source": "EbonyWand.cs",
    "damage": 1,
    "useTime": 25,
    "mana": 30,
    "knockBack": 0.0,
    "rarity": "Lt Purple",
    "obsolete": false,
    "hasRecipe": true,
    "isAccessory": false
  },
  {
    "id": "ElderWand",
    "_source": "ElderWand.cs",
    "damage": 150,
    "useTime": 18,
    "mana": 40,
    "knockBack": 6.0,
    "crit": 15,
    "rarity": "Red",
    "obsolete": false,
    "hasRecipe": false,
    "isAccessory": false
  },
  {
    "id": "ElmWand",
    "_source": "ElmWand.cs",
    "damage": 1,
    "useTime": 40,
    "mana": 25,
    "knockBack": 0.0,
    "rarity": "Lt Red",
    "obsolete": false,
    "hasRecipe": true,
    "isAccessory": false
  },
  {
    "id": "FiendfyreWand",
    "_source": "FiendfyreWand.cs",
    "damage": 95,
    "useTime": 25,
    "mana": 20,
    "knockBack": 4.0,
    "rarity": "Yellow",
    "obsolete": false,
    "hasRecipe": true,
    "isAccessory": false
  },
  {
    "id": "HawthornWand",
    "_source": "HawthornWand.cs",
    "damage": 38,
    "useTime": 22,
    "mana": 12,
    "knockBack": 4.0,
    "rarity": "Lt Red",
    "obsolete": false,
    "hasRecipe": true,
    "isAccessory": false
  },
  {
    "id": "HollyWand",
    "_source": "HollyWand.cs",
    "damage": 28,
    "useTime": 25,
    "mana": 10,
    "knockBack": 5.0,
    "rarity": "Orange",
    "obsolete": false,
    "hasRecipe": true,
    "isAccessory": false
  },
  {
    "id": "InfernalPhoenixWand",
    "_source": "InfernalPhoenixWand.cs",
    "damage": 52,
    "useTime": 16,
    "mana": 12,
    "knockBack": 4.0,
    "rarity": "Lt Purple",
    "obsolete": false,
    "hasRecipe": true,
    "isAccessory": false
  },
  {
    "id": "LarchWand",
    "_source": "LarchWand.cs",
    "damage": 1,
    "useTime": 30,
    "mana": 20,
    "knockBack": 0.0,
    "rarity": "Lt Red",
    "obsolete": false,
    "hasRecipe": true,
    "isAccessory": false
  },
  {
    "id": "OakWand",
    "_source": "OakWand.cs",
    "damage": 12,
    "useTime": 30,
    "mana": 6,
    "knockBack": 3.0,
    "rarity": "White",
    "obsolete": false,
    "hasRecipe": true,
    "isAccessory": false
  },
  {
    "id": "PhoenixFeatherWand",
    "_source": "PhoenixFeatherWand.cs",
    "damage": 30,
    "useTime": 18,
    "mana": 10,
    "knockBack": 4.0,
    "rarity": "Orange",
    "obsolete": false,
    "hasRecipe": true,
    "isAccessory": false
  },
  {
    "id": "RedOakWand",
    "_source": "RedOakWand.cs",
    "damage": 32,
    "useTime": 22,
    "mana": 10,
    "knockBack": 4.0,
    "rarity": "Orange",
    "obsolete": false,
    "hasRecipe": true,
    "isAccessory": false
  },
  {
    "id": "RowanWand",
    "_source": "RowanWand.cs",
    "damage": 30,
    "useTime": 30,
    "mana": 12,
    "knockBack": 8.0,
    "rarity": "Orange",
    "obsolete": false,
    "hasRecipe": true,
    "isAccessory": false
  },
  {
    "id": "ShadowElderWand",
    "_source": "ShadowElderWand.cs",
    "rarity": "Purple",
    "obsolete": true,
    "hasRecipe": false,
    "isAccessory": false
  },
  {
    "id": "UnicornHairWand",
    "_source": "UnicornHairWand.cs",
    "damage": 55,
    "useTime": 35,
    "mana": 20,
    "knockBack": 3.0,
    "rarity": "Pink",
    "obsolete": false,
    "hasRecipe": true,
    "isAccessory": false
  },
  {
    "id": "VineWand",
    "_source": "VineWand.cs",
    "damage": 25,
    "useTime": 22,
    "mana": 9,
    "knockBack": 4.0,
    "rarity": "Orange",
    "obsolete": false,
    "hasRecipe": true,
    "isAccessory": false
  },
  {
    "id": "WandOfDestiny",
    "_source": "WandOfDestiny.cs",
    "rarity": "Purple",
    "obsolete": true,
    "hasRecipe": false,
    "isAccessory": false
  },
  {
    "id": "WillowWand",
    "_source": "WillowWand.cs",
    "damage": 16,
    "useTime": 25,
    "mana": 7,
    "knockBack": 7.0,
    "rarity": "Blue",
    "obsolete": false,
    "hasRecipe": true,
    "isAccessory": false
  },
  {
    "id": "YewWand",
    "_source": "YewWand.cs",
    "damage": 48,
    "useTime": 8,
    "mana": 5,
    "knockBack": 2.0,
    "rarity": "Lt Purple",
    "obsolete": false,
    "hasRecipe": true,
    "isAccessory": false
  }
]