[
  {
    "id": "BasiliskFangDagger",
    "_source": "BasiliskFangDagger.cs",
    "damage": 40,
    "useTime": 12,
    "knockBack": 3.0,
    "crit": 10,
    "rarity": "Lt Red",
    "obsolete": false,
    "hasRecipe": true,
    "isAccessory": false
  },
  {
    "id": "BeatersBat",
    "_source": "BeatersBat.cs",
    "damage": 35,
    "useTime": 30,
    "knockBack": 15.0,
    "crit": 4,
    "rarity": "Orange",
    "obsolete": false,
    "hasRecipe": true,
    "isAccessory": false
  },
  {
    "id": "DarkArtsGrimoire",
    "_source": "DarkArtsGrimoire.cs",
    "damage": 72,
    "useTime": 20,
    "mana": 18,
    "knockBack": 4.0,
    "rarity": "Yellow",
    "obsolete": false,
    "hasRecipe": true,
    "isAccessory": false
  },
  {
    "id": "DecoyDetonator",
    "_source": "DecoyDetonator.cs",
    "damage": 45,
    "useTime": 30,
    "knockBack": 6.0,
    "rarity": "Orange",
    "projectile": "DecoyDetonatorProjectile",
    "obsolete": false,
    "hasRecipe": true,
    "isAccessory": false
  },
  {
    "id": "EnchantedTrollClub",
    "_source": "EnchantedTrollClub.cs",
    "damage": 48,
    "useTime": 32,
    "knockBack": 14.0,
    "crit": 6,
    "rarity": "Lt Red",
    "obsolete": false,
    "hasRecipe": true,
    "isAccessory": false
  },
  {
    "id": "FireboltBroomstick",
    "_source": "FireboltBroomstick.cs",
    "useTime": 20,
    "rarity": "Lt Purple",
    "obsolete": false,
    "hasRecipe": true,
    "isAccessory": false
  },
  {
    "id": "GoblinSilverSword",
    "_source": "GoblinSilverSword.cs",
    "damage": 45,
    "useTime": 20,
    "knockBack": 5.0,
    "crit": 8,
    "rarity": "Lt Red",
    "obsolete": false,
    "hasRecipe": true,
    "isAccessory": false
  },
  {
    "id": "HippogriffFeather",
    "_source": "HippogriffFeather.cs",
    "useTime": 20,
    "rarity": "Lt Purple",
    "obsolete": false,
    "hasRecipe": true,
    "isAccessory": false
  },
  {
    "id": "HouseElfBell",
    "_source": "HouseElfBell.cs",
    "damage": 25,
    "useTime": 30,
    "mana": 10,
    "knockBack": 4.0,
    "rarity": "Orange",
    "projectile": "HouseElfMinion",
    "buffType": "HouseElfMinionBuff",
    "obsolete": false,
    "hasRecipe": true,
    "isAccessory": false
  },
  {
    "id": "Howler",
    "_source": "Howler.cs",
    "damage": 32,
    "useTime": 25,
    "knockBack": 4.0,
    "rarity": "Blue",
    "projectile": "HowlerProjectile",
    "obsolete": false,
    "hasRecipe": true,
    "isAccessory": false
  },
  {
    "id": "HufflepuffsMace",
    "_source": "HufflepuffsMace.cs",
    "damage": 58,
    "useTime": 28,
    "knockBack": 10.0,
    "crit": 4,
    "rarity": "Lt Red",
    "obsolete": false,
    "hasRecipe": true,
    "isAccessory": false
  },
  {
    "id": "Nimbus2001Broomstick",
    "_source": "Nimbus2001Broomstick.cs",
    "useTime": 20,
    "rarity": "Red",
    "obsolete": false,
    "hasRecipe": true,
    "isAccessory": false
  },
  {
    "id": "NimbusBroomstick",
    "_source": "NimbusBroomstick.cs",
    "useTime": 20,
    "rarity": "Pink",
    "obsolete": false,
    "hasRecipe": true,
    "isAccessory": false
  },
  {
    "id": "PeruvianDarknessPowder",
    "_source": "PeruvianDarknessPowder.cs",
    "damage": 0,
    "useTime": 30,
    "knockBack": 0.0,
    "rarity": "Green",
    "projectile": "DarknessPowderProjectile",
    "obsolete": false,
    "hasRecipe": true,
    "isAccessory": false
  },
  {
    "id": "PhoenixFeatherStaff",
    "_source": "PhoenixFeatherStaff.cs",
    "damage": 45,
    "useTime": 36,
    "mana": 15,
    "knockBack": 3.0,
    "rarity": "Lt Purple",
    "projectile": "PhoenixMinion",
    "buffType": "PhoenixMinionBuff",
    "obsolete": false,
    "hasRecipe": true,
    "isAccessory": false
  },
  {
    "id": "Quaffle",
    "_source": "Quaffle.cs",
    "damage": 28,
    "useTime": 20,
    "knockBack": 5.0,
    "rarity": "Orange",
    "projectile": "QuaffleProjectile",
    "obsolete": false,
    "hasRecipe": true,
    "isAccessory": false
  },
  {
    "id": "RavenclawsStaff",
    "_source": "RavenclawsStaff.cs",
    "damage": 50,
    "useTime": 18,
    "mana": 5,
    "knockBack": 3.0,
    "rarity": "Lt Red",
    "obsolete": false,
    "hasRecipe": true,
    "isAccessory": false
  },
  {
    "id": "ScreechingHowler",
    "_source": "ScreechingHowler.cs",
    "damage": 55,
    "useTime": 25,
    "knockBack": 6.0,
    "rarity": "Lt Red",
    "projectile": "HowlerProjectile",
    "obsolete": false,
    "hasRecipe": true,
    "isAccessory": false
  },
  {
    "id": "SlytherinsDagger",
    "_source": "SlytherinsDagger.cs",
    "damage": 42,
    "useTime": 10,
    "knockBack": 2.0,
    "crit": 20,
    "rarity": "Lt Red",
    "obsolete": false,
    "hasRecipe": true,
    "isAccessory": false
  },
  {
    "id": "SwordOfGryffindor",
    "_source": "SwordOfGryffindor.cs",
    "damage": 55,
    "useTime": 18,
    "knockBack": 6.0,
    "crit": 8,
    "rarity": "Lt Red",
    "obsolete": false,
    "hasRecipe": false,
    "isAccessory": false
  },
  {
    "id": "ThestralReins",
    "_source": "ThestralReins.cs",
    "useTime": 20,
    "rarity": "Lt Red",
    "obsolete": false,
    "hasRecipe": true,
    "isAccessory": false
  },
  {
    "id": "TrollClub",
    "_source": "TrollClub.cs",
    "damage": 28,
    "useTime": 35,
    "knockBack": 12.0,
    "crit": 4,
    "rarity": "Blue",
    "obsolete": false,
    "hasRecipe": false,
    "isAccessory": false
  },
  {
    "id": "UmbridgesQuill",
    "_source": "UmbridgesQuill.cs",
    "damage": 25,
    "useTime": 15,
    "mana": 6,
    "knockBack": 2.0,
    "rarity": "Pink",
    "obsolete": false,
    "hasRecipe": false,
    "isAccessory": false
  },
  {
    "id": "VenomousSwordOfGryffindor",
    "_source": "VenomousSwordOfGryffindor.cs",
    "damage": 78,
    "useTime": 16,
    "knockBack": 7.0,
    "crit": 12,
    "rarity": "Yellow",
    "obsolete": false,
    "hasRecipe": true,
    "isAccessory": false
  },
  {
    "id": "WeasleyBlazeBox",
    "_source": "WeasleyBlazeBox.cs",
    "damage": 35,
    "useTime": 20,
    "knockBack": 4.0,
    "rarity": "Orange",
    "projectile": "BlazeBoxProjectile",
    "obsolete": false,
    "hasRecipe": true,
    "isAccessory": false
  },
  {
    "id": "WeasleyFireworks",
    "_source": "WeasleyFireworks.cs",
    "damage": 40,
    "useTime": 18,
    "knockBack": 5.0,
    "rarity": "Orange",
    "projectile": "WeasleyFireworkProjectile",
    "obsolete": false,
    "hasRecipe": true,
    "isAccessory": false
  },
  {
    "id": "WizardFishingRod",
    "_source": "WizardFishingRod.cs",
    "useTime": 8,
    "rarity": "Orange",
    "obsolete": false,
    "hasRecipe": true,
    "isAccessory": false
  }
]